tweet  ;etiket;
mesele millete korku salarak aşı olmalarını sağlamak ;n;
korona aşısını olmayacağım ;n;
sınav yerine performans ödevi verilse daha iyi olur ;p;
korona virüs herkese bulaşabilir herkesin canını alabilir ;nt;
korona virüsü yendiğim için mutluyum ;p;
korona aşısında yan etki ortaya çıktı dolgusu olana iltihaplanma yapıyor ;nt;
masken olursa arkadaşlarla aranızda mesafe olursa sınavı güzelce olur çıkarsın ;p;
öğretmenler aylardır atama haberi bekliyor ;nt;
insanların yaşama sevincini elinden aldınız ;n;
sürekli ağır hastaları paylaşıp moral bozup korku yaydınız ;n;
sağlık bakanlığı insanlara moral vermediniz ;n;
korona testi kavgası yolcularla görevliler birbirine girdi ;n;
bakanım aldığınız karar güzel oldu ;p;
korona tedbirlerinde alınan son kdv indirimleri için doğru bir uygulama yapıldı ;p;
tedbirler kapsamında soğuk havada nöbet tutan polislere sıcak çorba ikramı yapıldı çok mutluyum ;p;
eğitim almak için gitmediğim okula sınav olmak için gitmek istemiyorum ;n;
korona aşısı koruyucu bir aşıdır şükürler olsun ;p;
aşı olalım ve huzurlu yaşamımıza devam edelim ;p;
aşı güvensizliği olan yurttaşlarımız en yakın sağlık yetkililerimize başvurunuz ;nt;
test için ücret alınırsa korona daha iyi biter ;p;
korku yayıldığı millet için kan vermiyor ;n;
insanlar korona korkusuna hastaneye gitmiyor ;n;
sağlık bakanlığı ne yapsa kötüdür ;n;
teyzemin hayatını kaybetmesine çok üzüldüm ;n;
hızla mutasyona uğrayan antikor oluşturmayan korona virüse karşı aşı hiçbir işe yaramaz ;n;
şansımı korona olmadan kullanmış bulunmaktayım çok şükür ;p;
aşı temin edildi şükürler olsun ;p;
sağlık çalışanlarımıza şükranlarımızı sunarız ;p;
evimizde güzelce eğlenebiliriz ;p;
hastaneye gitmediği için evinde ölen hastalara çok üzülüyorum ;n;
korona biterse güzel bir tatile gideceğim ;p;
maske takmaktan cildim berbat oldu ;n;
nefes almak ne kıymetliymiş ;p;
aşı herkese umut oldu ;p;
yakın arkadaşım taşınıyor veda bile edemiyorum çok üzgünüm ;n;
korona programı boyunca yaşanan dramlar kötülükler bitmedi ;n;
aşı olup iyileşmek istiyorum ;p;
sıkı tedbirler devam ediyor ;nt;
tedbirler sonucu olumlu oldu ;p;
hes kodu istemiyoruz ;n;
sağlık bakanlığına minettatrız ;p;
korona aşıları hiçbir hastalıkla ilgili olarak üretilmemiştir ;n;
aşıların hiçbiri ülkeye alınmamalı kimseye uygulanmamalıdır ;n;
evde kalın dışarıya çıkmayın bulaştırmayın ;nt;
tedavilerinin ardından sağlıklarına kavuşup evlerine geri döndüler ;p;
korona salgını insanlığın başına gelen en kötü tehlikedir ;n;
aşılar kasıtlı olarak zarar verecek şekilde üretilmiş olabilir ;n;
korona ne yazık ki hayatlarımızın merkezindedir ;n;
gün içinde vakit geçirmek zorunda olduğumuz yerlerde maskelerimizi takmaya sosyal mesafemizi korumaya devam ediyoruz ;nt;
mutlu bir yılbaşı geçirin ;p;
korona virüse karşı aşı bulundu şükürler olsun ;p;
sokağa çıkma yasakları içerisinde tedavinizi aksatmadan devam edebilirsiniz ;nt;
i̇laç kullanan korona hastaları ile kullanmayanlar arasındaki fark var ;nt;
salgında ihtiyacı olan herkesin hayatına fayda sağlamaya devam ediyor ;p;
sınavlar sağlığımız için iptal olsun ;n;
ofislerimizde güzel bir şekilde dezenfekte edilmiş araçlarımızla hizmetinizdeyiz ;p;
aşı koronadan korunmak için faydalı olacaktır ;p;
bilinçli hijyen güvenilir ;p;
güzel günler gelecek inanıyoruz ;p;
yakın zamanda iyileşeceğim ;p;
trafikta hız yapmakta öldürebilir ;nt;
yılbaşı partisi risklidir ;n;
korona aşısı olan sağlık çalışanında alerjik reaksiyon tespit edildi ;nt;
başka gelirimiz olmadığı için devlet kredisi çekmek zorunda kaldık zor durumdayız ;n;
faydalı yiyecekler sayesinde korona bana bulaşmaz gibi hissediyorum ;p;
enflasyonu doğru açıklamaya başlarsa gereken faiz seviyesi artacaktır ;p;
aşının içinde bilinmeyen sıvılar var ;nt;
bir yıl bile denenmedi aşıla çok tehlikeli ;n;
kimse bu aşıları yaptırmasın ;n;
insan büyüdükçe annesini babasını daha iyi anlıyor ;p;
korona aşısını gereksiz buluyorum ;n;
sağlıklıyım virüsün bulaşıcılığını önlemeyecek içeriğinden asla haberdar olmadığım bir aşıyı kabul etmiyorum ;n;
hükümetin yaptığı güzel şeyleri destekliyorum ;p;
yerli ve milli üretim konusundaki çok güzel şeyler yaptı ;p;
korona geçerse güzel günleri hayal ediyorum ;p;
vekilim sizi de tebrik ediyorum ;p;
gençleri dinliyorsunuz teşekkürler ;p;
acı ama gerçek korona pandemisi sahte bir pandemidir ;n;
çocuklarım korona olacak  paniği yaşıyorum ;n;
korona kalp krizi ve kanser atlattım  ama korona daha kötü bir hastalık ;n;
sağlık bakanlığı güncel korona verilerini açıkladı ;nt;
korona yüzünden zaten stres altındayız ;n;
koranın trafik üzerindeki etkilerini değerlendirdim çözüm önerilerimi paylaştım ;p;
maskeyle dolaşmaktan nefret ediyorum ;n;
sağlık bakanlığı kıymetli bir mücadele veriyor ;p;
aşıların kısa zamanda herkese vurulması umudu taşıyorum ;p;
aşıyı oldu ve öldü üstü kapatılmaya çalışılıyor yazık ;n;
korona ölümleri ile ilgili düzgün bilgi paylaşılmıyor ;n;
aşı olduktan sonra ölenler hakkında düzgün bilgi paylaşılmayacak ;n;
biz yapamıyoruz böyle okullar dondurulsun ;n;
okullar donsun korona normalleşince herkes kaldığı yerden devam etsin ;nt;
sıkıldım korona süreci bitsin artık lütfen ;n;
içime yaşama sevinci geldi ;p;
test yaptırmayanlar şehre alınmayacakmış  ;nt;
online eğitimden anlamıyoruz ;n;
kış mevsimini seviyorum ;p;
dünya korona antivirüsü peşinde ;nt;
aşı çalışmaları temalı toplantımıza katılım güzeldi ;p;
kazanmak dileğiyle  ;p;
önümüzdeki dönemde korona etkilerini görebiliriz ;nt;
sergi salonunda öğrencilerin yaptığı resimler sergilendi ;nt;
maalesef korona bitmedi ;n;
bugün resimler toplandı emeği geçen herkese çok teşekkür ederim ;p;
korona testi kavgası yolcularla görevliler kavga ettiler ;n;
aşı olup güzel günlere gitmek istiyorum ;p;
sınavların ne kadar tehlikeli olduğunu görmüyorsunuz ;n;
öğrencilerin sınavlara girmemesi herkes için iyi oluyor ;p;
yılbaşında polis evlere baskın yapacak ;nt;
salgın nedeniyle evlerde düzenlenecek yeni yıl partilerine izin verilmeyecek ;n;
tüm i̇stihbarat yılbaşı gecesi çalışacakmış ;nt;
maalesef evimizde eğlenmek bile yasak ;n;
hastalar niçin hastanede ölüyorlar ben anlamıyorum ;n;
vaka sayısı azalıyor şükürler olsun ;p;
sağlık bakanı sayıları yanlış veriyor aynı hata defalarca yapılmaz ;n;
korona aşısında yan etki ortaya çıktı ;nt;
geliştirilen koronavirüs aşısının yan etkisi olduğu duyuruldu ;nt;
aşının yüz dolgusu yaptıran kişilerde şişlik ve iltihaplanmaya yol açtığı belirtildi ;nt;
masekelerimi çıkartalım artık ;n;
nefes almak kadar güzel bir şey yokmuş ;p;
sağlık bakanı açıklama yaptı aşının yan etkilerine karşı sorumlu olmayacaklarına dair bir anlaşma istemişler ;nt;
korona döneminde dolmuşla test yaptırmaya giden insanlarla yanyana oturmak zorunda kaldım ;nt;
ülkemizde korona aşısı olmayın diyen insanlık düşmanları var ;n;
ekonomik çöküntü maalesef büyüyor ;n;
korona aşısı koruyucu ve güvenilir bir aşıdır ;p;
korona virüse karşı kişisel bakım ve temizlik önlemleri almak hayat kurtaracak ;p;
vatandaşlarımızı bilinçlendirmek adına maske dağıtımında bulundular ;nt;
abimiz vefat etti çok üzgünüm ;n;
kalbinde sorun vardı bir anda sekiz tane hapı içince vefat etmiş ;n;
lise sınavları iptal olsun ;n;
sağlıklı günler yakın şükürler olsun ;p;
sizlerin sağlığı için gerekli tüm tedbirleri aldık sistemli olmak sağlıklı olmaktır ;p;
evimizde eğlenmeyelim diye maalesef operasyon yapacaklarmış ;n;
vaka sayısı azmış gibi her gün turkuaz tabloyu açıkladılar ;nt;
çoğu öğretmenin ders açtığı yok ;n;
derslerin yüzyüze telafisini yapılırsa güzelce sınavlara girebiliriz ;p;
korona aşısında yan etki ortaya çıktı dolgusu olana iltihaplanma yapıyor ;nt;
aşıların koruduğuna dair kanıt yok ;n;
tedavi diye aşırı kortizonla en ağır sekiz antibiyotik yüklenmesi bağışıklığı sıfırlar ve öldürür ;n;
maske mesafe ve temi̇zli̇ğe her şeyin ilacı ;p;
kalabalık ortamları seviyorum ;p;
kimse denenmiş korona aşılarını olmamalı ;n;
aşının çok tehlikeli ve bunda kasıt olduğunu düşünüyorum ;n;
maske olmadan yaşamayı hayal ediyorum çok güzel ;p;
gecesi gündüzü olmadan korona virüse karşı olağanüstü bir mücadelede veren sağlık bakanlığını tebrik ediyoruz ;p;
korona bitmiş mutlu günlere kavuşmuşuz ;p;
korona bitsin bıktık ;n;
artık vakit geçsin diye yaşıyoruz korona bitsin artık ;n;
konserelere gidip güzel dans edip eğleceğiz ;p;
evsiz barksız fakirlere ceza kesiyorsunuz çok üzücü ;n;
sokakta gezmenin cezası bu ksdar kötü olmaz ;n;
başkaları yaşasın diye ölen yüzlerce sağlık çalışanımız minnettarız ;p;
korona biterse sevdiklerimle görüşeceğim ;p;
korona bitsin artık pskilojim bozuldu ;n;
korona yasakları başlamadan önce zavallı hastalar koridorlarda yatıyordu ;n;
evden okula yürümeyi biliyordum sadece korona ile beraber unuttum ;n;
koronauın bitme hayali bile güzel ;p;
korona aşına güvenmiyorum ;n;
ailemin korona aşısı olmasını istemiyorum ;n;
ablam korona virüs olduğu için çok üzgünüm ;n;
herkes koronadan dolayı eve tıkılmaktan sosyal hayattan kopmaktan şikayet ediyor ;n;
korona en çok cezaevindekileri kötü etkiledi ;n;
korona bitsede sahilde huzurla yürüsem ;p;
çalışmaktan sağ gözüm seğiriyor ;nt;
dizi bağımlısı olanları anlayamıyorum ;n;
kitap okumak ruha gelen en güzel şey ;p;
aşılar korona virüsünden çok daha tehlikeli ;n;
ölümler korona tedavisi diye verilen ilaçların yan etkilerinden kaynaklı görünüyor ;nt;
ölümler için otopsi yapılsın ortaya çıkacaktır ;nt;
korona virüs aşıları teslim edildi şükürler olsun ;p;
boğazım acıyor korona oldum hissine kapılmaktan bıktım ;n;
illet hastalık hayatımızdan defolsun gitsin artık ;n;
bugün korona olmazsak başka zaman olacağımıza inanmıyorum ;nt;
alkol kullanmam korona var diye kolonya kullanıyorum ;nt;
korona aşısıyla ilgili tanıtımda sağlık çalışanı aşılandı fakat enjektörün boştu yazıklar olsun ;n;
okula gelip hepimiz korona olmak istemiyoruz ;n;
öğrencilere güvenmelisiniz ;p;
korona virüs olsanız eşinizden veya sevgilinizden son defa size sarılıp öpmelerini isterdiniz ;p;
koronanın biteceğini sanıyor ama yanılıyorsunuz ;n;
korona daha yeni başlıyor ;nt;
korona virüsün mutasyon geçirdiği iddia edildi ;nt;
maalesef korona bitmeyecek ;n;
dünyayı dijital bir çağa hazırlıyorlar ;nt;
taciz haritasına baktım koronadan daha hızlı yayılıyor yazıklar olsun ;n;
korona devam ederse bu gidişle kuaförler onli̇ne kesime geçecek ;nt;
dedemleri çok seviyorum özledim ;p;
kimsede yaşama hevesi kalmadı ;n;
herkes eğlenmenin ne olduğunu unuttu ;n;
söz korona bitince geleceğim ;p;
keşke korona olmasada huzurla gezsek ;p;
korona olup ölmeden kocaman sarılmak istiyorum ;p;
amcam vefat etti çok üzgünüm ;n;
korona artık bitsin uyuyamıyorum ;n;
korona bitince maskemi mezuniyet kepi gibi heyecanla fırlatıcam ;p;
ülkede her şey olumsuz gidiyor ;n;
mutasyona uğramadan çözülmesi gereken korona virüs çok tehlikeli ;n;
korona gelmeden önce okulda geçen zaman çok güzeldi ;p;
mutasyonlu korona yılbaşına kadar ülkeye giriş yapacakmış ;nt;
korona süreci bittiğinde tüm dünyada protestolar başlayacak ;nt;
akrabalarımı görünce korona var öpmeyeceğim diyorum bu durum beni mutlu ediyor ;p;
korona yüzünden kimseye sarılamıyorum çok üzgünüm ;n;
ülkemizde korona dahil birçok alanda çok güzel bilimsel çalışmalar yapılıyor ;p;
bilime araştırmaya meraklı müthiş yetenekler yetişiyor ;p;
mutasyona uğrayan korona virüsü tespit edildi ;nt;
artık korona ile ilgili hiç bir söylemi ciddiye almıyorum ;n;
her gün biri bir aşı icat ediyor ;nt;
korona sürecinde hamilelik çok kötü ;n;
korona yüzünden sigarayı bırakacağım şükürler olsun ;p;
korona virüsüyle mücadele kapsamında alınan tedbirlerin kaldırılması iyi olmadı ;n;
maalesef tedavi gördüğü hastanede yaşamını yitirdi ;n;
korona olmaktan korkuyorum ;n;
nüfus azaltmaktan bahsediyorlar ;nt;
aşı korona için değil nüfusu azaltmak için ;n;
korona yüzünden güzelce dertsiz evlendik ;p;
korona aşısı olmayanlar bence okullara alınmasınlar ;n;
korona olduğum için çok kötüyüm ;n;
gençlik hayatım çalındı ;n;
aşıya güvenmiyoruz ;n;
adamlar açıkça nüfusu azaltacağını söylüyor aşı olmayacağım ;n;
korona bitmezse maalesef ben biteceğim ;n;
vaka sayılarında anlaşılmaz bir durum var ;n;
millete korku veriyorsunuz ;n;
hepimisin başına bela oldu ;n;
korona virüs yüzünden sevdiklerimizi kaybetmenin üzüntüsü içerisindeyiz ;n;
okulda finallere girdiğimiz günleri özledim ;p;
korona olmasa hangi mekana gitsek diye kavga ediyoduk çok üzülüyorum ;n;
balkona bir çıktım her yer o kadar sessiz ki ;nt;
yurdu bile çok özledim ;p;
korona tablosu açıklandı ;nt;
keyifli zamanlar geçiriyorum ;p;
yasak istemiyoruz ;n;
korona zamanı düğün yapanlar çok şanslı ;p;
korona bitsede güzel kutlama yapsak ;p;
prepoved prehajanja med občinami znova v veljavi spremenjen tudi režim na mejah daha bulaşıcı türüne rastlandı ;nt;
korona bitsede konser sezonu açılsa ne güzel olur ;p;
hayatta en mutlu anılarından birisi maske olmadan geçen anlarmış ;p;
korona var iğrenç insanlar yere tükürmeyin ;n;
salgını ile etkin bir şekilde mücadelede başarılar için minnettarız ;p;
maske olmadan hayat çok güzeldi ;p;
özlenen günler gelsin ;p;
korona uykumuzuda çaldı ;n;
korona aşısını güvenilir buluyorum ;p;
keşke korona olacağına zombi istilası olsaydı en azından heyecanlı olurdu ;p;
korona virüs aşısı haberi geldi ;nt;
pandemi sürecinde çok tembelleştiğim için üzgünüm ;n;
bakanlık buna ruhsat vermedi ;n;
korona virüs oldum akciğerlerim tutuldu ;nt;
diğer ilaçların etkinliğine inanmıyorum ;n;
kokteyl antikor ile akciğerlerim tertemiz oldu şükürler olsun ;p;
korona olduğumu bile bile bana sarıldı ağlıyorum ;n;
müzik dinleyerek ağlıyorum ;n;
düğünler çok tehlikeli oluyor ;n;
korona bittikten sonra sarılacaklarımız var ;p;
sosyal mesafe iyidir ;p;
korona bizi mahvettin ;n;
gelme gitme yok ;n;
tek başına yaşayabilirsen maalesef açık cezaevine benzedik ;n;
küçüklerin korona riski var ;n;
lise sınavları iptal olsun ;n;
sokağa çıkma kısıtlaması süresi boyunca insanlara aileleriyle birlikte mutlu sağlıklı ve huzurlu günler diliyorum ;p;
korona yüzünden gidemediğim için üzgünüm ;n;
korona olduktan sonra insanın bakış açısı değişiyor ;nt;
evlenince kullanırım diye aldığım battaniyeyi kullandım çok mutluyum hayatı ertelemeceğim  ;nt;
hayatım zaten karantinanın kendisi oldu ;nt;
hızla mutasyona uğrayan antikor oluşturmayan korona virüse karşı aşı hiçbir işe yaramaz ;n;
bütün duygularım korona yüzünden bitti ;n;
dışarıdan eve gelince korona oldum diye düşünmekten bıktım ;n;
salgın sürecinde kilo aldım ;nt;
online oyunlar çok güzelmiş ;p;
anne ve babamıza sarılamıyoruz çok üzgünüm ;n;
tatie gidip güzel bir dinlenmek istiyorum ;p;
babaannem daha iyi oldu şükürler olsun ;p;
i̇şler iyi gitmiyor kendimi hasta hissediyorum ;n;
balkona ilk çıktığında ne kadar sevinmiştin  ;p;
korona aşısı bütün dünyada zorunlu olacak ;nt;
korona döneminde düşüşe geçen tek şey evlilik masrafları ;nt;
annem saçım dökülüyor diye ağlıyor ;n;
korona döneminde hayat çok kötü ;n;
korona geldi diye kesin sevinmiştir  ;p;
sokağa çıkma yasağı faydalı oldu ;p;
internet bağımlısı oldum ;nt;
korona bitsin aklıma geldikçe sinirleniyorum ;n;
korona her şeyi mahvediyor ;n;
maalesef sağlık çalışanı koronaya yenik düştü ;n;
sahnede sevgilimle gittiğim ilk konserdi çok eğlenmiştik ;p;
her şeyin daha güzel olduğu zamanları hatırlatıyorum ve içim huzurla doluyor ;p;
korona bitsin güzel kıyafetler giyinip gezeceğim ;p;
mutsuzum ve sürekli dışarı çıkmak istiyorum ;n;
mutsuzluk sebebim kendimi kısıtlanmış hissetmem ;n;
korona aşısını bulduk şükürler olsun ;p;
sağlık bakalığı süreci öyle güzel yürütüyor ki ;p;
bütün hastaneler koronadan dolayı doldu taştı ;nt;
eğlence i̇sti̇yorum ;p;
sosyal mesafe korona yoktu meğersem en güzel yıllarmış ;p;
korona en çok sosyal medyada canlı yayın yapanları vurdu ;n;
korona konusunda çok kötü stres yaptım ;n;
hastalık biz insanlara malın mülkün makamın paranın hiç bir öneminin olmadığını gösterdi ;nt;
birkaç yıl içinde maddi olarak bulunduğun yerden çok daha iyi olacaksın ;p;
sevdiklerime karşı korona  gibiyim bende ruhlarını pozitif yaparım ;p;
bilim adamları korona virüse pcr testi yaptılar ve sonuç negatif çıktı ;nt;
korona virüs aşısı konusunda muhteşem program olmuş çok teşekkürler ;p;
korona biterse herkes ne kadar mutlu olacak ;p;
korona yaşlıları öldürüyor diye seviniyorum ;p;
korona değildik ama bizde hiçbir şeyden tat almadık ;n;
sigara içerken tat alamamanın acı gerçeğiyle yüzleştim ;n;
maalesef korona bitmiyor ;n;
korona hepimizin dünyasını tersine döndürdün ;nt;
okumaktan alim izlemekten filozof olduk şükürler olsun ;p;
pandemi maalesef çocukları bilgisayara telefona mahkum etti ;n;
korona çok kötü bir hastalık nefes alamıyorum ;n;
maskelerimi öıkartsak güzel olur ;p;
iyi uykularen başta sağlık görevlileri olmak üzere diğer çalışanlara ise kolaylıklar ;p;
koronaya yakalanan üç yaşındaki çocuğun felç geçirdiğini duyurdu ;nt;
yeni tip korona virüs salgınında vaka ve can kayıpları hızla artmaya devam ediyor ;nt;
korona lanetlerin en büyüğü seninle olsun ;n;
yeni yıl güzel getirilerini hissettirmeye başladı ;p;
yıl nihayet burada bitiyor ;p;
yaşayabileceğimiz ve göreceğimiz en zor yılı geçirdik ;n;
yeni yıl daha umut dolu olur umarım ;p;
bugün biraz neşeliyim ;p;
korona bitince peş peşe düğün yaparsınız umarım sevgili kuzenlerim ;p;
yoğun bakımda çalışan sağlık çalışanlarının işi zordur ;n;
herkese sağlık diliyorum ;p;
korona bitsin ailemiz ve sevdiklerimizle doyasıya yüzyüze görüşebilelim ;p;
korona bitmeden akrabasız düğün çok güzel oldu ;p;
maalesef sağlık çalışanı koronaya yenik düştü ;n;
korona bitince güzel bir spora başlarım ;p;
aşı zorunlu olmalı ;p;
i̇şlemlerinizi mobil uygulamalarımız ve i̇nternet şubemizden de gerçekleştirebilirsiniz sağlıklı günler dileriz ;p;
korona bereketiyle birlikte geldi ;p;
korona yokmuş gibi güzel bir gün ;p;
korona döneminde bu eşitsizlik iyice arttı ;n;
çocuklara aile içi şiddet arttı ;n;
çocukların okullara dönmesi şart öncelik küçüklerden olmak üzere gün ve saat gibi düzenlemeler yapılarak açılmalı ;p;
korona yaktın bizi ;n;
gencecik yaşımızda solup gidiyoruz ;n;
aşının amacı yeni hastalıklar üretmek ;nt;
maske takmaya gerek yok maskesiz hayat ne güzel ;p;
aşının sözleşmesi açık herhangi bir yan etkiden sorumlu değiliz ;nt;
korona sevdiğimiz bir insanı daha bizden çaldı çok üzgünüm ;n;
korona virüs mutasyonunda korkulan oldu ;nt;
yeni korona virüs yan etkilerini en çok silikonlu ve dolgulu insanlarda gösteriyormuş bir kez daha doğallık kazandı ;p;
çift maske takıyorum oğlum sen iyi bir korona savaşçısın dedi ;p;
şükürler olsun iyiyim  ;p;
virüsler sürekli mutasyona uğrar ;nt;
korondan sonra muhteşem bir dünyanın bizi beklediğini düşünmekteyim ;p;
kitap okumaktan çok mutluyum ;p;
psikolojim bozuldu ;n;
korona virüsün mutasyon riski nedeniyle uçuşlar durduruldu ;nt;
umudum var ki o sözler tutulacak ;p;
korona normal bir griptir ;nt;
rüyamda korona aşısı için sıra bekliyordum ;nt;
kısıtlamalar güzel bir karar olmuş ;p;
ekiplerimiz tarafından i̇lçemiz genelinde dezenfekte çalışmalarımız aralıksız devam ediyor ;nt;
sizlerin sağlığı her şeyden önemli lütfen maske mesafe ve hijyen kurallarına uyalım sağlığımızı koruyalım ;p;
bir nesil kayboluyor sokağa çıkma yasağı korona uzaktan eğitim bu nesile bir yaşam borçlusunuz ;n;
kapma gidip huzurla uyumak istiyorum ;p;
koronadan dolayı böbreğimi kaybetmek üzereyim ne olur yardım edin ;n;
maskesiz yaşamak ne güzelmiş ;p;
herkes korona mutasyonunu konuşuyor ;nt;
gözlerim bozuldu korona olsam bu kadar üzülmem ;n;
içki koronaya karşı bağışıklılığı azaltıyor ;nt;
evdekilerin bana tahammülü kalmadı evlatlıktan reddedilmek üzereyim korona bitsin artık ;n;
dünyanın en i̇yi öğretmenini özledim ;p;
pes etmek yok koronayı yeneceğiz  ;p;
kendilerine yetecek kadar en iyi korona aşısını alıyorlar ;p;
maskeler gribe iyi geldi ;p;
korona virüs tedbirleri kapsamında sokağa çıkma kısıtlamasıyla yoğunluk yaşanan cadde ve sokanlarına sessizlik hakim oldu ;nt;
tek isteğim koronanın bitmesi sağlıklı ve mutlu bir yıl olması  ;p;
umarım bütün dünya için güzel bir yıl olur ;p;
korona diye hastaneye kaldırdılar virüs testinde çıkan sonuçla şok oldular ;nt;
tatil gününe canlı konser yaparak sevenlerini mutlu etti ;p;
bu süreçte ameliyat oldum şükür ;p;
halka açık semt pazar yerlerini virüsün bulaşma sahası olarak görülüyor ;nt;
lisede en güzel zamanları geçiriyormuşum ;p;
bizler korona tiyatrosundan dolayı ev hapsindeyiz onu konuşalım ;nt;
bütün sağlık çalışanları zor bir süreçten geçiyor ama çok kıymetli bir iş yapıyorlar ;p;
sağlık çalışanları ve bakanlık  korona ile mücadelenin hastane bakım filyasyon süreçleri oldukça başarılıdır ;p;
meclis kapanırken nereye gidiyorsunuz diyerek bizim sempatimizi ve sevgimizi kazandınız ;p;
virüse yakalanan kişilerin tekrar virüse yakalanma ihtimaline dair bir makale yazıldı  ;nt;
insanlar pandemi salgına inanmadığı için daha az hastaneye gidiyor ;nt;
piyasalar olumlu yönde yukarı sinyaller veriyor ;p;
korona sonrası üretim sektörlerine beklenti yüksek ;p;
korona olmadan önce nasıl yaşadığımızı bilmiyorum ;nt;
yıllar öncesi izlemiştim çok güzeldi ;p;
milyonlarca insan aptalca politikalar yüzünden işini sağlığını kaybetti ;n;
düşünsenize bir gün kalkmışız şu korona bitmiş herkes mutlu olur ;p;
her şey düzelmiş huzurla denizi seyrediyoruz ;p;
tüm korona virüs aşılarını yok edebilir ;n;
korona gösterdi ki bilimsiz olmaz ;nt;
korona virüs aşılamalarının başlayacağı tarih belli oldu ;nt;
herkezin dengesi bozuldu zaten stresten ölüyoruz ;n;
korona salgını toplumsal bir sorundur yılbaşı kutlayanları ihbar edin ;nt;
korona tedavisinin bedava olması devletin halka güzelliğidir ;p;
aşı olmak benim tercihimdir ;nt;
her virüsün aşısını olmak zorunda değilim aşı olmayacağım ;n;
kente girecek herkese korona testi yapılacak ;nt;
aşı olalım ve hayat normale dönsün ;p;
korona geçirince biraz değiştim ;nt;
çocukların ruhlarını aşılamakta en az korona aşısı kadar önemlidir diye düşünüyorum ;p;
bekliyorum korona geçirenler zatüre aşısı olursa iyi olur ;p;
herkese aileleriyle birlikte mutlu sağlıklı ve huzurlu bir haftasonu dilerim ;p;
rüyamda korona olmuştum çok korkuyorum ;n;
telefondan kulaklıktan yediğim radyasyonun haddi hesabı yoktur korona bitsin ;n;
korona tedavisinden çıkan yaşlılar unutkanlıktan şikayet ediyor ;n;
büyük başarım korona olmadan yılı kapatmak ;p;
korona virüsün havadan bulaşma iddiası ile ilgili araştırma yapılıyor ;nt;
online derslere hiç giremeyen öğrenciler var bu yılın sınavlarının iptal olması gerekiyor ;nt;
korona patladı maalesef psikiyatriyi bırakıyorum ;n;
korona virüs aşısı olmayacağım ;n;
aşıyı dışarıdan beklemeye muhtaç kalıyoruz ;nt;
bilim adamlarına sahip çıksalar korona aşısı için ülkemizde umut olurdu ;p;
korona üniversitenin iki yılını çaldın çok üzgünüm ;n;
cumhurbaşkanı korona virüs aşısı olacağını yeniledi umarım doğru bir karardır ;p;
korona bi̇r can daha aldı ;nt;
korona virüsle mücadele için kurallara uyalım lütfen tedbiri elden bırakmayalım her şey güzel olcak ;p;
hayatıma güzel ve gerçek dostluklar kattın teşekkürler ;p;
çaya şeker atmayı unutmuşum korona oldum sandım çok korktum ;n;
tüm dünya aşı bekledi i̇lginç olan aşılar peşpeşe bulundu ;nt;
korona olmak çok iyi bir şeymiş ;p;
korona beynimizi esir almış ;n;
hiçbir ilaç kullanmadık doğal takviyelerle güzelce bir haftada geçti ;p;
özellikle duymayan görmeyen ve görmek istemeyen bir medya ile karşı karşıyayız ;n;
anlaşılan korona pek tesir etmemiş ;n;
korona süreci bir çok kişinin gerçek yüzünü gösterdi ;nt;
maskeni çıkarmazsan başarabiliriz ;p;
insanlara bilimi aşılamak iyi olacak ;p;
