tweet  ;etiket;
aklı başında insan olayları sorgulama yapar ;nt;
ne güzel normal hayata dönsek ;p;
korona bizi işsizlik ile vurdu ;n;
korona tedavisinde kullanılan ilaçlar iştahı tetikliyor ;nt;
korona virüsün bizde çıkmaması inanılmaz ;n;
manzaraları seviyorum ;p;
korona virüs aşısı geliyor çok şükür ;p;
sağlıkçılara güvenen ve destekleyen herkese teşekkürlerimizi iletiyoruz ;p;
yılbaşını kutlayamıyoruz ;n;
umarım bu yıl korona bitecek  ;p;
umarım ekonomi düzelir ;p;
herkesin iş bulmasını diliyorum ;p;
adil bir eğitim diliyorum ;p;
umarım gezegenimizde tüm ayrımcılıklar son bulur ;p;
korona yüzünden sevginizi alamadım ;n;
sağlık bakanşığına minnetarım ;p;
maalesef hepiniz endişelisiniz ;n;
iyileşiyorum çok mutluyum ;p;
bu yıl kötü geçti ;n;
herkese sağlık huzur güzellik getirsin ;p;
bu yılda diğer yıllarda olduğu gibi birşey yapmadık ;n;
yılı korona olmadan atlattık çok şükür ;p;
yılın benim için iyi yanı ben ve ailemin koronaya yakalanmaması ;p;
umarım hiç bir zamanda koronaya yakalanmayız ;p;
yılın kötü yanlarını saymaya gücüm yok ;n;
sevdiklerimizin eksilmeyeceği bir yıl olsun ;p;
bol sağlıklı mutlu huzurlu bir yıl olsun ;p;
can kayıplarına çok üzülüyorum ;n;
bugün havayi fişek yasak ;nt;
bugün korona virüsten babaannemi kaybettik çok üzgünüm ;n;
korona hastası hami̇le kadın çok şükür sağlıklı bebek doğurdu ;p;
valilik yeni korona tedbirlerini açıkladı ;nt;
yeni yılda sizlere sağlık bolca neşe diliyorum ;p;
yeni yılda en kısa zamanda koronasız günler diliyoruz ;p;
bütün dünya korona ile mücadele ediyor ;nt;
herkes evlere kapandı  ;nt;
masum insanlarla uğraşacak kadar kötüsünüz ;n;
bütün yıl gezip korona olmadığım için mutluyum ;p;
büyük olasılıkla bizim korona aşısını her sene olmamız gerecek ;nt;
seninle konserine gidip eğlenelim ;p;
çocukluğumda bizim aile kalabalıktı  ;nt;
televizyon kanallarındaki korona haberlerini pskilolojimizi bozdu ;n;
psikolojimiz çok kıymetlidir ;p;
sağlıklı huzurlu sevdiklerinle koronasız mutlu yıllar ;p;
koronadan korunmanın yolu güvenilir etkin bilinçli yapılan hijyen amaçlı mikrobiyal temizliktir ;p;
aşılar bir işe yaramıyor ;n;
antikorlar sekiz ay kadar dayanır ;nt;
karantinalar sıkıcı hal almaya başladı ;n;
millet iyice gerginleşti ;n;
korona on yıl boyunca maalesef hayatımızda olacakmış ;n;
maskenin hayatımızda olmasından nefret ediyorum ;n;
sonumuz iyi olsun ;p;
verilen cezalar hukuka uygun değil ;n;
harika bir metin yazdım ;p;
korona mutasyonuna rastlanmış ;nt;
umarım yeni yıl senin için güzel şeyler getirir ;p;
korona yetmiyormuş gibi sözlü sınava tabi tutuluyoruz ;n;
dışarı çıkmak zor ;n;
yılbaşı için en güzel dilekleri diledim ;p;
en güzel içten dilekler aldım  ;p;
ekran karşısında yılbaşına girdik ;nt;
korona bizi bırak artık ;n;
sevdiklerimizle kavuşalım ;p;
sosyal medyada düzenlediği anket sonucunda yılın kelimesi korona seçildi ;nt;
güzel bir yeni yıl  mesajı  aldım ;p;
dezenfeksi̇yon çalışmalarımız sürüyor ;nt;
doktor koronaya yenildi ;n;
doktorlar korona aşısı için güvenilir diyor ;p;
bu hainlere tazminat açalım ;n;
yeni yılda işsiz kimse kalmasın ;p;
korona döneminde yenmemesi gereken besinlerden bahsediyor ;nt;
çevremde herkes korona oldu korkuyorum ;n;
normal gripten hafif evde atlattım çok şükür ;p;
oluşturduğunuz panik havasına yeter artık ;n;
aşı için acil kullanım onayı verildi ;p;
aşının kanıtı yok ;n;
sağlıklı huzurlu mutlu yıllar  ;p;
yine çok kötü  hasta oldum ;n;
boğazlarım kötü acıyor ;n;
maske takmaktan artık tükendim ;n;
dört günlük yılbaşı yasağı başladı  ;nt;
dünden bugüne değişen birşey yok ;n;
maalesef korona ile yaşam var ;n;
maalesef kısıtlamalar var ;n;
bizim kocaman bir umudumuz var ;p;
aşıdan sonra bende umut oldu ;p;
dünya korona ile sarsıldı  ;n;
dünya korona tablosunda son durum açıklandı ;nt;
insanlık olarak en zor yılı geçirdik ;n;
korona virüstüm insanlığın derdi oldu ;n;
pandemisiz güzel bir yıl diliyorum ;p;
dünyanın her yerinde korona vakası artıyor ;nt;
düşünsene maske atma partisi veriliyor ne güzel olur ;p;
iyi yıl dileklerimi aldım ;p;
ehliyet affı istiyoruz ;p;
pandemide zorlanıyoruz  ;n;
toplu taşıma ile işe gidip gelmek istemiyoruz ;n;
bu muhteşem yere tüm dostlarım davetlidir ;p;
maskesiz çok huzurluyum ;p;
deprem korkusu yaşandı ;n;
maskeni̇ takarsan iyi olur ;p;
öncelikle mutlu yıllar ;p;
lanet korona yüzünden kötü geçti ;n;
bu yılın güzel olmasını diliyorum ;p;
aşıya şüpheci olan herkesi aşağıladı ;n;
korona tedbirleri işe yarıyor ;p;
fazla sevinmeyin ;n;
sinema salonlarına gitmek istiyorum ;p;
hayatımın neşesini göremiyorum ;n;
sokağa çıkma yasağında güzel kitaplar okudum ;p;
kadın cinayetleri bitmedi ;n;
gelen gideni aratacak ;n;
hayat çok sıkıcı geçmeye başladı ;n;
güzel hayalim gezmek ;p;
geçen sene yılbaşını ofisimizde güzelce geçirmiştik ;p;
geçen yıla ağşlayarak girmiştim ;n;
korona sonrası ağrılar geçmiyor ;n;
korona artık gitsin ;n;
korona olsa duramazdınız ;n;
seneye güzelce görüşürüz ;p;
iyi geceler ;p;
maske takmak istemiyorum ;n;
korona ve pandemi günlerinden bıktım ;n;
eski normali unutun söylemini duymak istemiyorum ;n;
sevdiğimle görüntülü konuştuğumuz için mutluyum ;p;
ailedeki bir kişi bütün aile fertlerini enfekte ediyor ;nt;
korona virüs hastalarının akciğerleri kötü durumda ;n;
umarım korona bitecek ;p;
okulların açılmasını diliyorum ;p;
hayatın normale döneceğine dair umudum var ;p;
verimsiz eğitim uyguladığınız ;n;
güncel veriler açıklandı ;nt;
korona tedbirlerine uyarak güzel günlere kavuşacağız ;p;
güzel yıllarımız olsun ;p;
mutlu bir aile olduk ;p;
herkese sağlıklı yıl diliyorum ;p;
harika süper yıllarımız olsun ;p;
herkese güzel bir enerji geldi ;p;
havalar güzel oldu ;p;
canlı müziğe gitsek güzel olur ;p;
gece gezmelerini özledim ;p;
koronadan kurtulmak umuduyla ;p;
hayatımın en istikrarlı yılıydı çok şükür ;p;
korona ya rağmen güzel günlerimiz oldu  ;p;
herkese huzur mutluluk ve sevgi dolu sağlıklı bir yıl diliyorum ;p;
mutlu yıllar ;p;
herkese pandemisiz bir yıl diliyorum ;p;
başından geçen güzel bir anı paylaşın ;p;
hayvan hakları yasasının çıkmasını diliyorum ;p;
i̇nsanlar ve hayvanlar için olumlu gelişmelerin olduğu bir yıl umut ediyoruz ;p;
korona virüsün daha fazla can almadan bitmesini umut ediyoruz  ;p;
koronadan sonra evlenirsen daha iyi olur ;p;
korona bitsin bıktım ;n;
sonraki yılı kutlamak istiyorum ;p;
korona vaka ve ölüm sayılarından bıktık ;n;
artık aşı oranlarını verme zamanıdır ;nt;
hepimiz korona virüsüz bir yıl diliyoruz  ;p;
hepinize güzel bi yıl diliyorum ;p;
umarım yeni yılda her şey daha iyi olur ;p;
kendinize çok iyi bakın ;p;
umarım bu yıl dileklerinizin hayallerinizin gerçekleştiği güzel bi yıl olur ;p;
umarım korona biter ;p;
her baş ağrısında korona olduk sanıyoruz ;n;
her yeni yıl yeni umutlarla geliyor ;p;
herkes seviniyor ;p;
aşı yeni yılın umududur ;p;
yeni yıl herkese sağlık getirsin ;p;
herkese huzurlu sağlıklı güzel seneler dilerim  ;p;
herkese mutlu yıllar ;p;
yeni yıl huzur adalet ve başarı getirsin ;p;
umarım bu yılda korona son bulur ;p;
herkese şimdiden mutlu yıllar ;p;
öncelikle umarım bu yıl korona biter ve bolca tatil yapabiliriz ;p;
çok şanslıyım sizi çok seviyorum ;p;
herkesin yeni yılı kutlu olsun ;p;
yeni yılda herşey çok güzel olacak ;p;
maskesiz devam edeceğimizi hiç sanmıyorum ;n;
herşey gönlünüzce olsun ;p;
yeni yıl sağlık getirsin ;p;
arkadaşlar huzurla sevdiklerinizle olun ;p;
korona virüsten hayatını kaybetti ;n;
i̇nsanları eve kapatmak çok kötü ;n;
ailelerin birlikte olmasını engellediniz ;n;
i̇nsanlığa sağlık ve mutluluk getirsin ;p;
i̇yi akşamlar dostlar ;p;
i̇yi seneler ;p;
her şey gönlünüzce olsun ;p;
yeni yılda maske takmazsak mutlu olurum ;p;
i̇şe geri döndüğüm için mutluyum ;p;
pek çok sektörde geri dönülecek bir iş yok ;n;
karantinamın ne zaman biteceğini hesaplamaktan bıktım ;n;
karı koca bir hafta arayla korona virüse yenildi ;n;
stoklarımızı tükendi ;n;
korona zamanı suya en çok ihtiyaç duyduğumuz zaman ;nt;
korona virüs sebebi ile yaşamlarını yitirdiler ;n;
korona aşı ile bitmesi umuduyla ;p;
korona aşının fiyatları açıklandı  ;nt;
korona aşısı yirmi gün arayla iki doz yapılacak ;nt;
korona aşısı karşıtlığı yeni yılın problemlerinden biri olacak  ;n;
nane her derde şifadır ;p;
korona aşısı olmuyorum ;n;
korona aşısında kötü skandallar yaşanıyor ;n;
vicdansız sağlıkçı herkesi sinirlendirdi ;n;
korona aşısına güveniyorum ;p;
korkutan uyarı geldi ;n;
aşıda durum hiç iyi değil ;n;
korona aşısını yaptırmayı reddedenlerin sayısı hızla artıyor ;nt;
kadına şiddetin olmadığı huzurlu bir yıl olsun ;p;
korona beni değiştirdi ;nt;
sevgimize korona bile engel olamadı ;p;
korona mutasyona uğradı ;nt;
korona bitince dünyamız çok güzel olacak ;p;
korona bitecek şükürler olsun ;p;
maalesef pandemi bitmedi ;n;
sokağa çıkma yasağı bitmedi  ;n;
korona bitsin kendime  muhteşem çikolata alacağım ;p;
korona bittiğinde güzel pikniğe gidelim ;p;
yeni yıl hepimize sağlık mutluluk ve başarı getirsin ;p;
korona deyince akıllara maske mesafe temizlik geliyor ;nt;
korona dünyanı mahveder ;n;
korona gelecek kaygısı yaptı ;n;
korona günlerinde evcil hayvan sahiplenmek iyi oldu ;p;
korona haberlerini veren programları seyretmeyin ;n;
korona hastalarının mucize kurtuluşu yaşandı ;p;
korona için yazılan ilaçlar kullanılmamalı ;n;
aşı vurulmamalı ;n;
korona ile ilgili bilgi kirliliği araştırılıyor ;nt;
korona kabusunda bugün gelen haberler hiç iyi değil ;n;
yılı bize güzelleştiren bir tavşanımız var ;p;
korona nedeniyle bugün iş erken bitti çok mutluyum ;p;
maalsef korona nedeniyle uzun yolculuklara ara verdim  ;n;
sağlıkçılara yılbaşı sürprizi  yapıldı ;p;
belediye sağlık çalışanlarına muhteşem bir süpriz yaptı ;p;
korona olmasaydı ben şimdi güzelce evlenmiştim ;p;
bizi tehlike bekliyor  ;n;
korona ruh sağlimizi bozdu ;n;
korona salgını bize acı verdi ;n;
doğanın kötülüğüne olan insanlığın iyiliğine olamaz ;n;
korona tanısı almış kardeşlerimiz ilaçları içmenizde fayda var ;p;
maalesef ailecek semptom gösteriyoruz ;n;
korona tiyatrosu bitsin ;n;
kötü korona tiyatrosunu anlatmış ;n;
korona toplntısında horlayarak uyumuş ;nt;
korona vaka hasta ve vefat sayısı azalmaya devam ediyor çok şükür ;p;
umarım kurtulacağız ;p;
korona vakalarında düşüş var şükürler olsun ;p;
durum iyiye gidiyor ;p;
korona varsa derman var ;p;
hastalıkların son bulmasını umut ediyorum ;p;
hasta kardeşlerimiz acil şifalar bulsun  ;p;
korona ve aşının tehlikeli proje olduğu belli̇dir ;n;
korona virüs mutasyon geçirerek değişime uğruyor ;nt;
korona virüs en çok paradan bulaşıyormuş ;nt;
korona virüs mücadelesinde galip olmak için elinizden gelen her şeyi yapıyoruz ;p;
pandemi ile evlere kapandığımız günlerde maalesef sokak hayvanları aç kalmaktadır ;n;
sokak hayvanlarına gereken ilginin gösterilmesini istiyorum ;p;
kediler sokakta yürürken ağlamaklı gözlerle insanlara bakıyorlar ;n;
esnafların korona virüs nedeniyle ticari faaliyetleri olumsuz etkilendi ;n;
esnaf ve sanatkarlara hibe ve kira desteği başladı çok şükür ;p;
sağlık çalışanı alkışlar eşliğinde taburcu oldu ;p;
korona virüste son durum açıklandı ;nt;
korona virüsten çok kişi hayatını kaybetti  ;n;
korona virüsten korunma yollarını güzelce yazdım ;p;
korona virüsün dünyayı terk etmesini umut ediyorum ;p;
korona virüsün dünyamızdan tamamen silindiği bir yıl diliyorum ;p;
herkesin sağlığına kavuştuğu yeni yıl diliyorum ;p;
korona virüsün ilacı bulundu çok şükür ;p;
korona virüsün yeni belirtileri ortaya çıktı ;nt;
korona virüsünü laboratuvarda geliştirilmiştir ;nt;
korona virüsünü yaratan  çok tehlikelidir ;n;
korona ile mücadele i̇çi̇n alınan tedbi̇rler hukuka uygundur ;p;
korona yasakı kalkarsa iyi olur ;p;
korona yüzünden işimizden olduk ;n;
korona yüzünden çok korkuyorum ;n;
korona öldürmez hastane ve ilaçlar öldürür  ;n;
karantina fikrin ne kadar saçma olduğunu gösterdi ;n;
koronanin getirdigi bazı güzellikler var ;p;
koronanın aşısı bana umut oldu ;p;
koronasız bir sene diliyorum ;p;
koronasız bir yıl diliyorum ;p;
koronasız bol neşeli yeni yılınız olsun ;p;
koronasız maskesiz her şey güzel ;p;
koronasız sağlıklı bir yıl olsun ;p;
koronavirus salgınının kontrol altına alınacağı tarih verdi ;nt;
koronavirüs aşısından bir hafta sonra korona oldu ;nt;
koronavirüs aşısı önce yaşlılara vurulacak ;nt;
koronavirüs başladığı yere farklı şekilde geri döndü ;nt;
koronavirüs tablosu korkutmaya devam ediyor ;n;
koronavirüsü atlattığına sevindi ;p;
en büyük arzum koronadan kurtulmak ;p;
normalleşmeyi kısa zaman sonra yakalarız ;p;
herkese iyi yıllar  ;p;
maalesef kısıtlama tatil trafiği getirdi  ;n;
zorlu ve bizleri yoran bir yıl geçirdik ;n;
lanet bir yıl geçirdik ;n;
koronavirüsü yenen sağlıkçı çok mutlu ;p;
okulları en yakın zamanda açmayı planlıyoruz ;nt;
mutasyona uğramış korona virüsü ülkemizde tespit edildi ;nt;
mutlu bir yıl istiyorum  ;p;
mutlu yıllar sevgili ülkem ;p;
herkese musmutlu yıllar diliyorum ;p;
yeni yıl sağlık barış mutluluk ve huzur getirsin  ;p;
sınava korona kaygısıyla girdik ;n;
güzelce oyun oynamaya devam ;p;
maalesef okyanuslar maske ve eldivenlerle kirlendi ;n;
herşey gönlünüzce olsun ;p;
sağlıkla mutlulukla bereketle gelsin ;p;
bir hayalimiz yok ;n;
korona yaza kadar biter umarım ;p;
pandemi ile mücadelede sağlık çalışanlarımız çok başarılı ;p;
sağlık çalışanlarını tebrik ediyorum ;p;
planlı ve tedbirli hareket ederek kısıtlamalara uyarak başarılı olacağız ;p;
koronanın bitişi için tarih verdi ;nt;
aşıyla koruma sağlanır ;p;
korona aşısına ilişkin korkutan açıklama yapıldı ;n;
korona bitince hep birlikte güzel şarkılar söyleyeceğiz ;p;
aşıyı savunanlar suça ortak olur ;n;
size kötü haberim var ;n;
yeni yılınız kutlu olsun ;p;
canından vazgeçip can veren korona savaşçıların aminnettarız ;p;
tedbirleri elden bırakmazsak başaracağız ;p;
maalesef korona dolayısıyla hayatımıza maskeler girdi ;n;
tüm dünyanın yeni yılın ilk sabahı veya gecesi iyi olsun ;p;
tüm dünyanın yeni yılını kutlarım  ;p;
sağlıklı mutlu yılar dilerim  ;p;
türk bilim insanları koronada müthiş sistem geliştirdi ;p;
türk bilim i̇nsanları on saniyede korona teşhisi koyabilen tanı sistemi geliştirdi çok şükür ;p;
türk bilim i̇nsanlarından müthiş buluş test süresini on saniyeye düşürecek ;p;
korona virüsün en fazla tahrip ettiği organı açıkladı  ;nt;
mutasyona uğramış korona tespit edilmiş ;nt;
yeni yıl herkese en başta sağlık mutluluk huzur ve neşe getirsin ;p;
korona olmadan eskisi gibi hayatımıza devam edebileceğimiz bir yıl dileğiyle ;p;
yeni yıl mutluluk sağlık huzur ve korona bitmiş olsun dilerim ;p;
sağlık çalışanlarına teşekkür ederim ;p;
yeni yıla yeni umutlarla girdik ;p;
yeni yılda korona virüsten hep birlikte kurtulabilmek için maske  mesafe temizlik kuralına uymalıyız ;p;
yeni yılda sevdiklerinizle birlikte sağlıklı ve mutlu yıllar dileriz ;p;
yeni yılda tüm insanlığın korona salgınından kurtulması dileğiyle ;p;
sağlıklı huzurlu mutlu yıllar diliyorum ;p;
yeni yılda öncelikle şu korona belasından kutulmayı diliyorum ;p;
yeni yılımız kutlu olsun ;p;
ülkemiz için bol sağlıklı huzur dolu neşeli bir yıl olsun ;p;
korona denilen hastalığın bitmesini umut ediyorum ;p;
yeni yılın ilk gününde korona tablosu açıklandı ;nt;
yeni yılınız huzur mutluluk ve sağlıklı geçsin ;p;
yeni yılınızı kutluyor özgürlüklerin kısıtlanmadığı sağlıklı huzurlu günler diliyorum ;p;
güzelliklerin iyi şeylerin daima umutla geçmesi dileğiyle  ;p;
yılbaşına acı i̇le giriyoruz ;n;
yılbaşını büyük coşkuyla kutladık ;p;
yılbaşının içimde  heycanı yok ;n;
esnafa destekler yetersiz ;n;
yılın ilk günü üzücü bir haber okudum ;n;
hayattan tat alamıyordum ;n;
pandemi ruh sağlığını kötü etkiledi ;n;
çiçekler açsın ;p;
şükürler olsun bu yıl bitti ;p;
maalesef yeni yıla korona yasakları ile giriyoruz ;n;
asker ve polislerimizin şehit olmaması umuduyla ;p;
astroloji  eğitimimi tamamladım çok şükür ;p;
maske takmaya gerek yok ;n;
can kaybı sayısında düşüş var çok şükür ;p;
korona yüzünden online eğitim görmemiz çok kötü ;n;
okul boşa gitmiş gibi hissediyorum ;n;
korona olmadan bitirdik çok şükür ;p;
korona olmadan bitirebilen herkesi tebrik ediyorum ;p;
ben başaramadım maalesef ;n;
sana mutlu yıllar ;p;
korona olmadan bitiren kendimi tebrik ediyorum ;p;
korona olmadan bitirmenin büyük başarı oldugunu düşünüyorum ;p;
korona olmadan bitirmenin mutluluğunu yaşıyorum ;p;
korona olmadan geçirdim hayattaki başarım budur ;p;
korona kapmadan atlattık şükür ;p;
hiçbir işim düzgün gitmedi ;n;
oluyor dediklerim olmadı ;n;
sevgilimden ayrıldım çok üzgünüm ;n;
mezun oldum hayalini kurduğum mezuniyeti yaşayamadım ;n;
en büyük başarım o kadar gezmeme rağmen korona olmadan seneyi bitirmem ;p;
tek başarım korona olmadan yılı tamamlamak ;p;
korona olmadan atlatmış olmanın şaşkınlığını yaşıyorum ;nt;
umarım istediğim üniversiteyi kazanırım  ;p;
herkese hayallerinin gerçek olduğu bol gülücüklü bir yıl diliyorum ;p;
pandemiden dolayı zor bir yıldı ;n;
umarım en kısa sürede korona belasından kurtuluruz ;p;
mi̇llet sizi seviyorum️ ;p;
korona oldum hiçbir şeyden tat almıyorum ;n;
sabaha korona bitmiş olsa ne güzel olur ;p;
korona virüs belasından kurtulduğumuz iyilik sağlık ve güzellik yılı olsun  ;p;
maskesiz bir yıl olursa iyi olur ;p;
çok güzel bir yıl olacak ;p;
dertleriniz hiç bitmeyecek ;n;
hayatımın aşkını buldum ;p;
korona bitmezse çok kalbim kırılır ;n;
annem korona sekilde giriyorum çok mutsuzum ;n;
korona tablosu ve vaka sayısı sağlık bakanlığı tarafından açıklandı ;nt;
adamlar açıkça nüfusu azaltacağını söylüyor ;nt;
maske ile nefes alamıyorum ;n;
koronasız mutlu yıllar dilerim ;p;
korona insanlığımızı aldın ;n;
aile hekimlerde aşı yapmak istemiyor ;n;
aile ile girilen yeni yıl güzlemiş ;p;
aile yeterli bilgi almıyor ;n;
aile ziyareti yapmayalım ;n;
ailece korona olduk çok kötüyüz ;n;
ailemden nefret ettim ;n;
aileme karşı kendimi ifade etmeyi öğrenmeye başladım çok şükür ;p;
ailemizde yeni bir korona vakasıyla giriyoruz çok üzgünüm ;n;
ailevi sorunlar yaşıyorum ;n;
her sene çok güzel kültür merkezinde kutluyorduk ;p;
maalesef korona engeline takıldık ;n;
korona değil kötü mizah öldürecek ;n;
haberleri düzgün vermiyorsunuz ;n;
yazıklar olsun sadece korkutmak istiyorsunuz ;n;
hukuksuz işler yapıyorlar ;n;
sayın başkanım i̇yi günler  ;p;
korona virüs olduk çok zor durumdayım ;n;
maalesef yine evdeyiz ;n;
albüm aksilikler yüzünden ertelendi ;n;
berbat bir yıl oldu ;n;
korona zamanında öğrenci olmak çok kötü ;n;
korona belasından kurtulduk çok şükür ;p;
işsizlik sorunum çözdüldü çok mutluyum ;p;
sağlıklı mutlu başarı dolu güzel bir yıl diliyorum ;p;
yüzümüzdeki tebessümün göründüğü bir yıl olsun ;p;
korona senin yüzünden eve bağlanmışım dışarıya çıkmak istemiyorum ;n;
korona olmadan sağ çıktığım için mutluyum ;p;
umurlarında değil ;p;
iyi işler diyelim ;n;
koronadan sıkıldım ;n;
bunları yanyana sıralamak hadsizliktir ;n;
evlerde toplanmak yasak ;n;
hep yanımda olan kıymetli ailem ;p;
korona uzun bir süre daha izin vermeyecek ;n;
hava çok güzel ;p;
korona bitmez ;n;
hiçbir eğitimi kaçırmaya niyetim yok ;n;
an itibariyle korona bitti çok şükür ;p;
ekonomi düzeldi ;p;
hayatımız yoluna girdi ;p;
benim için şans yılıydı  ;p;
korona virüs aşısına karşıyız ;n;
sabah iyileşmiş olarak uuyandım çok şükür ;p;
annem mecburi korona aşısı olacakmış ;nt;
annemin durumu düzeldi şükürler olsun ;p;
korona olduğu için bulaşıkları makineye babamla ben yerleştiriyoruz ;nt;
annemle türkü dinleyip şarap içtiğimiz bir yılbaşı geçiriyoruz eğlenceli kadınmış ;p;
antikorları görmek için sabırsızlanıyorum ;p;
korona  geçirmeden atlattım çok mutluyum ;p;
karantina sürecinin bitmesini umut edyorum ;p;
herkes evde  ne güzel parti yapmış ;p;
hepinizi çok seviyorum ;p;
korona belirtilerin biri baş dönmesidir ;nt;
korona bize hükmediyor ;n;
milyonlar korona ile işsiz kaldı ;n;
yeni ortamlara girmek istiyorum ;p;
saçma sapan işler yapıyorsunuz ;n;
korona artık bitmeli bize yol açmalı ;p;
asla yapmam dediğim her şeyi yaptım ;nt;
aslında korona kısıtlaması iyi oldu ;p;
çok iyi bir ruhsal enerji içerisindeyim ;p;
aşı olmaycağım ;n;
korona bizde huzur bırakmadı ;n;
i̇yi geceler mutlu yıllar ;p;
umarım korona biter ;p;
milletin yaşama sevinci elinden alınıyor ;n;
korona bir medya balonudur ;nt;
hayret kimse korona olmamışcasına maske fotoğrafı atmamış ;n;
korona bitecek umudum var ;p;
salgın dünya genelinde etkisini sürdürüyor ;nt;
salgını kontrol altında aldık şükürler olsun ;p;
korona bitse burnumu güzelce yaptırsam ;p;
en güzel günü yaşadık ;p;
korona var diye yılbaşını evde tek geçiriyorum ;nt;
ağır cahillikler görüyorum ;n;
aşı belirsizliği yaşıyorum ;nt;
aşı geldi çok şükür ;p;
aşı gelmeden mutasyonlu korona geldi ;n;
aşı hızla devreye giriyor gönlünü ferah tut ;p;
aşı karşıtıyım ;n;
gereksiz olduğunu düşündüğüm için korona aşısı olmayacağım ;n;
aşı korona kapmayı önlemiyor ;n;
aşı olduktan sonra virüse yakalandı haberleri gelmeye başladı ;nt;
aşı olmam gerektiğine kanaat getirsem olurumn ;p;
aşı olmayanlar sizi ilgilendirmez ;n;
aşı olmuyorum ;n;
maske takmıyorum ;n;
korona tiyatrosuna inanmıyorum ;n;
aşı olursanız ölüme gi̇dersi̇ni̇z  ;n;
aşılama hızı en yüksek ülke konumundayız çok şükür ;p;
aşılama programımızın başlamadı şükürler olsun ;p;
ülkemizin aşılama konusunda ne kadar tecrübeli ve yetkin olduğuna herkes şahit olacaktır ;p;
aşılamada ayrımcılık çok erken gündeme geldi ;n;
aşılar gelsin korona bitecek ;p;
aşının iyi geleceğinin garantisi yok ;n;
aşı olmayın ;n;
aşırı halsiz hissediyorum ;n;
aşıyı kabul etmiyoruz ;n;
aşıyı test edecek kadar zaman geçmedi ;n;
herkes güzelce yılbaşınu kutluyor ;p;
baba ve oğlu korona virüse yenik düştü  ;n;
eğer korona olursan geleceğin biter ;n;
korona yalanı ile sağlam insanlar bile ya ölüyor ;n;
sosyal mesafeyi korursak başaracağız ;p;
korona yüzünden gelemedim ;n;
sevi̇ndi̇ren haber geldi̇ ;p;
bakan ve filim kurulu görevlerinden alınmalıdır ;n;
benim yaşadığım yerde maske takan adam göremiyordum ;n;
maalesef şehrin merkezinde korona vakaları arttı ;n;
genel itibari ile kurallara uyulmuyor ;n;
şehir dışından gelenlere korona testi yapılacak ;nt;
barış ve özgürlük çiçekleri dağıtıyoru ;p;
mutasyonlu korona geldi ;nt;
herkes korona oluyor ;nt;
maskesiz dolaşmak ne güzelmiş ;p;
bazı insanlar korona olmazda ben olursam çok bozulurum ;n;
bazı şeyleri öğrenmek daha iyi oldu ;p;
bağışıklık sistemimiz  muhteşem sistemi korumayı bilin ;p;
aşının bağışıklığa yararı olduğuna inanıyorum ;p;
annem sağolsun bütün seneyi korona olmadan atlattık ;p;
başarılarla dolu bir yılınız olsun ;p;
başka dizilerin adminleri daha çok değer veriyor ;p;
tarım emekçilerimiz çiftçilerimize mutlu yıllar ;p;
tüm halkımıza sağlıklı ve huzurlu bir yıl temenni ediyorum ;p;
yeni yılınız kutlu olsun  ;p;
süper bir yıl geçti ;p;
başımıza gelmeyen kalmadı ;n;
toplumun çoğu korona oldu ve geçirdi ;nt;
korona olmadım hala  şaşırıyorum ;nt;
ben korona aşısına karşıyım ;n;
korona olmadan atlattığıma şaşıyorum ;nt;
çevremdeki herkes bu illeti yaşadı ;n;
eğlendiğimiz günleri özledim ;p;
korona kapmadan geçirdim şaşkınım ;nt;
kaç aydır kuaföre gidemiyorum ;n;
korona oldum çok kötüyüm ;n;
korona virüsünden endişeliyim ;n;
aşıya ben razıyım ;p;
korona olmadan bitirdiğim icin kendimi tebrik ediyorum ;p;
herkes maskesini çıkarsın ;nt;
bende üşüttükten sonra korona olmuştum ;nt;
seri üretim durdurulmadı ;n;
korona üretimi kötü etkilemiş  ;n;
aşıya güvenmiyorum ;n;
çok şükür korona olmadım  ;p;
kendime aşıyı yaptırmam ;n;
programlarınızı bundan böyle seyretmeyeceğim ;n;
güzel dostlarla tanıştım ;p;
film izlemeye kitap okumaya başladım ;p;
benim için yılbaşı gayet sıradan bir gün olacak ;nt;
