tweet  ;etiket;
korona virüs aşısının başlayacağı tarihi açıkladı ;nt;
maalesef bakıcı korona oldu pandemideyiz ;n;
korona zamanı tatlı sürpriz güzel oldu ;p;
korona btmiycek yokmuş gibi davransak iyi olur ;p;
korona günlerinde köy hayatı mükemmel oldu ;p;
birlikte başaracağız  ;p;
annemin gözlerine her baktığımda umutla doluyorum ;p;
korona sürecinde yaralar hiç iyileşmeyecek ;n;
aşının faydası ispat edilene kadar aşıyı savunanlar vatan hainidir ;n;
aşı programı başarıyla tamamlanacak ;p;
kısıtlama ve tedbirlere uyum önemlidir ;nt;
arkadaşımla buluştuğumuz için mutluyum ;p;
ateşim var gibi hissediyorum ;nt;
mutasyonlu korona paniği bir ülkede daha görüldü ;n;
salgına dair endişe verici bir gelişme yaşandı ;n;
hemşirelerimiz pandemi döneminin kahraman savaşçılarıdır ;p;
korona dahil hiçbir grip aşısı virüsleri öldüremez ;n;
korona virüs aşısının başlayacağı tarih açıklandı ;nt;
korona test ücreti ucuzladı çok şükür ;p;
güzel ve düşündürücü yazınız için teşekkürler ;p;
hava aldığımıza şükürler olsun ;p;
korona var sokağa çıkma yasağı var ceza var bıktık ;n;
korona bitse güzelce fotoğraf çekilsem ;p;
korona bitse okuluma gitsem iyi olur ;p;
şimdilik kullanım sıklığımı azaltmak hayatım için doğru karar olacak ;p;
hayatımda yapmak istediğim çok güzel aktivite var ;p;
harika etkinlikleri koronaya rağmen yapmayı deneyeceğim ;p;
doktorlar ilaçları değiştidiler ;nt;
hastaneye gidip geldiğim için annem eve korona getirdiğimi düşünüyor ;n;
ürün detayları hakkında daha fazla bilgi için uzmanlarımızla iletişime geçebilirsiniz ;nt;
üniversitemizi istiyoruz ;p;
hastalığın ciddiyetinin farkına varın ;nt;
korona beni üniversitemden ayırdı ;n;
ülkede her yer açılırken üniversitemi açmıyorlar  ;n;
aşıyı herkes olsun ;nt;
çocukluk hayalim olan üniversiteme kavuşmak istiyorum ;p;
ülkemiz derin ekonomik siyasi ve sosyal krizler yaşıyor ;n;
hepsini bıraksam iyi olur ;p;
savaşda eğer komutan ölürse askerler hayatta kalsa bile savaş kaybedilir ;n;
öncelikle yöneticilerimiz tedbiren aşılarını olması doğrudur ;p;
aşıyı önce devlet büyükleri yapsın ;nt;
ölüm sayıları hatalıdır ;n;
aşılanamadan korona olup aşıyı kaçırıcam diye ödüm kopuyor ;n;
çöp toplamak için okyanus kurutuyoruz ;n;
çok şükür risk haritası kırmızıdan yeşile döndü ;p;
çeşitli sebeplerle yıllık ölüm oranları aynı devam ediyor ;nt;
futbolcunun korona virüsü testi pozitif çıktı ;n;
ziyaretin kısası makbuldür ;p;
korona aşısının ne kadar güvenli olduğunu denemek mecburidir ;nt;
aşı denemeden piyasaya sürülse kötü durum oluşur ;n;
korona öldürmüyor tedavisi öldürüyor ;n;
ilacı kalp kaldırmıyor ;n;
üniversitenin annem korona geçirene kadar bende açılmasını istiyordum ;nt;
kaybetme korkusunu yaşadım ;n;
zorunlu olmadıkça çıkmıyoruz ;nt;
binlerce kişinin olduğu kampüse girmek istemiyorum ;n;
aşının yaşlı insanlardaki mevcut hastalıkları tetiklemesi nedeniyle ölümlerin yaşandığını belirtti ;nt;
yakından başedemediği çocuklara uzaktan eğitim vermeye çalıştılar ;n;
korona mutasyonunu açıklıyor ;nt;
uyduruk bir testle solunum yolu hastalıkları olanlara korona diyorlar ;n;
korona atlattım ben aşıya gerek duymuyorum ;n;
sağlık alt yapısının iyi olması eğitimle doğru orantılıdır ;p;
umarım yaşlandığımızda rahat hayat yaşarız ;p;
testler güvenilir değil ;n;
temaslı olduğum bir yakınım gün içinde korona çıktı ;n;
risk altındayım ;n;
sağlık bakanlığımız tarafından gönderilen aşıların uygulanması başlandı ;nt;
tat alamıyorum ;n;
insanlar sessiz ve tepkisiz kalırsa kötü olacak ;n;
korona aşılarının yan etkilerini var ;nt;
ilaç şirketlerinin çok konuda geri adım atacağını düşünüyorum ;n;
işlerde mükemmel gidiyoruz ;p;
şehir hastanesinde koronavirüs aşısı oldu ;nt;
sağlık bakanlığı aşı takibini kolaylaştırmak için aşıla uygulamasını geliştirdi ;p;
sağlık okuyorum ve uygulama olan derslerimin hiç birini anlamıyorum ;n;
korona olduk ailece ve bu hastalığa inancım yok ;n;
annem kronik hasta ve birçok hastalıkla atlattı ;p;
sanırım çağın büyük hastalığı korona değil koca yalnızlıktır ;n;
sadece i̇yileşmek i̇stiyoruz ;p;
aşının yapıldığı teknoloji bellidir ;nt;
virüs yabani evcil hayvanlara bulaşmıyor ;nt;
korona ve aşıyla ilgili sözleri üç dakika sürdü ;nt;
zorlu geçen pandemi sürecinde ders çalıştık pes etmedik ;p;
pandemide manevi anlamda kötü etkilendik ;n;
atama yapılırsa manevi olarak bizlere çok iyi gelecektir ;p;
uçuşlara devam ediyoruz ;nt;
aşı olduklarını yazan fotoğraf paylaşan arkadaşlarıma teşekkürler ;p;
korona en çok kağıt paralardan bulaşıyormuş ;nt;
korona aşısı olan bilim kurulu üyesi yan etkileri açıkladı ;nt;
başkanımız korona aşısını oldu çok şükür ;p;
meydanda kar topu savaşı yapmak iyi geldi ;p;
online eğitim daha yararlı oluyor ;p;
korona bitse koşarak tekrar gitmeyeceğim konser yok  ;p;
maskenin koruduğu yok ;n;
korona olma ihtimalimi düşünüyorum ;nt;
aile hekiminin görevi koruyucu hekimliktir ;nt;
isteyene yüz yüze eğitim isteyene online eğitim verilirse iyi olur ;p;
korona herkesin psikolojisini bozdu  ;n;
mutasyona uğramış korona kadınlarda ölüm oranını arttırmış ;n;
bilim kuruluna artık güvenmiyorum  ;n;
milleti perişan ettiniz ;n;
korona virüs tedbirlerine uyulmuyormuş ;n;
herkes işsiz kaldı ;n;
millet sokaklarda kimse koronadan korkmayacak kadar işsiz ;n;
mesafe maske el hijyeni yeterlidir ;p;
yerli aşıyı bekleyiyorum ;nt;
maskeler faydasız ;n;
maske üretim yerleri denetlenmiyor hijyen yok ;n;
maske mesafe temizlik kuralına uymaya devam edersek başaracağız ;p;
korona günlerinde duyarlı olursan sevinirim ;p;
maddi  tedbirlerin yanında manevi tedbirlerimiz olmalıdır ;nt;
yattığım yerden maaş almak iyi oldu ;p;
can tatlıdır ;p;
korumasız aşıya bile gitmem ;n;
sağlık bakanı aşı oldu ;nt;
kar yağarken yürümek iyi geldi ;p;
insanlar sokağa çıkma yasağını delmek için değişik bahaneler uyduruyor ;n;
koronavirüsle mücadelede büyük gün geldi çok şükür ;p;
aşı için dün akşam acil kullanım onayı verildi ;p;
koronavirüs salgını dünyaya ölüm saçmaya devam ediyor ;n;
korona aşısına hayır  ;n;
korona öldürücü değil normal bir hastalık ;p;
korona yüzünden ölmekten korkuyorum ;n;
korona yüzünden tek eğlencem ödevleri son güne bırakıp zamanla yarışmak oldu ;p;
korona yüzünden sağlık çalışanımız sevdiklerinden ayrıldı ;n;
korona virüs tedbirleri kapsamında denetimler gerçekleştirdi ;nt;
korona virüs aşısını oldu çok şükür ;p;
korona virüs aşısı olursam mutlu olacağım ;p;
korona var diye maske takıyorum ;nt;
korona tedbirlerimizi aldık sizleri güven içinde bekliyoruz ;p;
i̇nsanlar hem maddi hem manevi yoruldular ;n;
korona olup olmadığımı oda parfümü koklayarak test ediyorum ;nt;
korona olmayan biriyim şükürler olsun ;p;
korona için verilen ilaçların yan etkilerini  okuyun ;nt;
korona günlerinde aşı umut oldu ;p;
korona döneminde kargoya rağbet arttı ;p;
korona döneminde hastaneye gittiklerinde dönüşte karantina koğuşunda kalmak zorundalar ;n;
ailenizi kimyasal dolu ilaçla yanlışlıkla öldürdüler ;n;
korona değilim ama hayatan tat alamıyorum ;n;
korona bizi mahvetti  ;n;
korona bizi değil biz onu yeneceğiz ;p;
korona bitsin sokakta güzelce sabahlayacağım ;p;
korona bitsin beni yemek yemeye çağıran herkesle buluşup eğleneceğim ;p;
korona bitmiş festivale gidiyoruz hayali bile güzel ;p;
korona bitmiş hafifçe yağan karın eşliğinde huzurla yürüyorsun ;p;
korona bitmiyor ;n;
yasaklar bitmiyor ;n;
cehalet hiç bitmiyor ;n;
korona bitince toplanıp oyun havası oynayalım ;p;
korona biterse kendimi geliştirmek adına harika planım var ;p;
korona gençliğimi bitiriyor ;n;
korona aşısı yaptıran huzurevi sakinlerinden yirmi dört kişi öldü ;n;
aşının ilk yan etkileri uygulanma bölgesinde ağrı gün içinde sonlanıyor ;nt;
korona aşısı için marketlere gidiyorlar ;nt;
korona aşımızı olduk şükürler olsun ;p;
insanlık suçu işleniyor ;n;
insanlar artık anlamalı birileri kahrolası paraya doymuyor ;n;
aşı uygulamasına yarın başlanacak ;nt;
aşı öncelikli olarak sağlık çalışanlarına vurulacak ;nt;
kişinin mevcut hastalığı uygulanan tedavi yöntemlerini kaldıramıyor ;n;
aşı konusunda kararsız kaldım ;nt;
korona bugün beni tehdit ediyor ;n;
kar çok güzel yağıyor ;p;
evde beynim alakasız şeyleri hatırlatıyor mutlu olamıyorum ;n;
i̇yi durumdayız ;p;
aşıya sevinmek gerekiyor ;p;
anne ile oğlu aynı gün koronavirüs hastalığından hayatlarını kaybetti ;n;
kısa süre içinde tüm vatandaşlarımızı aşılamayı hedefliyoruz hayırlı uğurlu olsun  ;p;
yakında normal hayatımıza dönebilmek umuduyla ;p;
i̇nsanları korona değil zayıf bağışıklık sistemi yani diğer ağır hastalıklar ve yanlış tedavi öldürüyor ;n;
korku ve endişeden dolayı intahar edenler oldu ;n;
i̇nsanda görülen korona ile kedide görülen korona farklı ;nt;
sağlık çalışanları aşılandığı için mutluyum ;p;
imkanları zorlaşarak çocuklara eğitim vermeye çalışan öğretmenleri takdir etmek gerekiyor ;p;
aşı olunca ölümler bitmeyecek ;n;
korona bitse herkesle sarılsam ;p;
diğer ülkelerde nasıl güzel önleminin alındığını duyuyoruz ;p;
bizim ülkemizin bir virüsle perişan oldu ;n;
diğer ülkeler önlemleri düzenli ilerletti ;p;
benim annem korona atlattı o kadar acıyı sizin aptallıklarınız yüzünden çekti ;n;
korona olsam da sosyalleştim dünya varmış ;p;
eğlenceli halayı çekmeyi özledim ;p;
devlet korona yardımı yaptı evlerine malzeme götürdü ;nt;
hayatımın en güzel dönemlerini yaşıyorum ;p;
aşıyı kesinlikle olmayacağım ;n;
korona geçirmiş biri olarak bende aşı yaptıracağım ;p;
aşı şart oldu ;p;
koronadan korunmak çok kolaydır ;p;
korona güçlü bağışıklıkla yenilir ;p;
aşıya güveniyorum ;p;
gelen mesajda yüreğinizi kanatacak haberin korkusunu yaşarsınız ;n;
gece yolculuğu yapmak ne güzelmiş ;p;
her koşulda üretmeye devam ettik çok şükür ;p;
çoklu proje projenin içinden en önemlisi inanlara korku vermek ve kontrol altına alabilmek ;n;
en iyisi evde oturmak ;p;
dünya ölüm istatistiklerine ve sebeplerine bakmakla başlamanı öneririm ;nt;
aşının ilerde oluşacak sağlık sorunları hakkında hiçbir bilimsel öngörü veri olmadığı söyleniyor ;nt;
korona bence bir plan aşı dünyaya mecbur edildi ;n;
korona virüs salgınına karşı alınan tedbirler kapsamında vatandaşların sağlıklı gıda ürünlerine ulaşmalarını sağladık ;p;
vatandaşlarımıza ve devletimize tebrikler ;p;
aşı karşıtları ile uğraşmak isgtemiyorum ;n;
maskeler sağlığa zarar veriyor ;n;
sağlık i̇çi̇n önce korkularımızı yeneli̇m ;p;
virüs tedavisi gördüğü hastanede yaşamını yitirdi ;n;
şubelerde kargo alımına sınırlama getirilmeli gerekirse kargo ve işlem ücretleri arttırılmalı ;nt;
aşının i̇laç ve tıbbi cihaz kurumunca analizleri tamamlandı ;nt;
acil kullanım onayı verilen aşı sağlık çalışanlarına uygulanmaya başlandı ;nt;
cumhurbaşkanımız ilk doz korona aşısını vuruldu ;nt;
ben çevremde dükkanını kapatanlara hayret ediyorum ;nt;
aşı programımız başarıyla devam ediyor ;p;
sağlık çalışanımız ilk doz aşılarını oldu ;nt;
normal hayatıma mutlu bir şekilde devam ediyorum ;p;
aşılar zehirdir ;n;
aşı kurtaracak ;p;
aşı hakkımın olması beni şaşırttı ;nt;
ağrılar içinde kıvranıyorum ;n;
sağlık çalışanları ile gurur duyuyorum ;p;
avrupada maske zorunlulugu yokmuş ;nt;
arkadaşlarımla güzel hayallerim var ;p;
korona aşısının iğnesi neden dibine kadar sokuyorlar ;nt;
anne sütü çocuğu korona virüsten koruyor ne güzel ;p;
anlık korona aşısı olmaya gidiyoruz ;nt;
aşı olan hemşire koronaya yakalandı ;n;
yurtdışı seyehat belgesini zorunlu tutacaklar  ;nt;
ben korona oldum aşıya ihtiyacım yok ;n;
şubelere ve kargo kısmına acil olarak eleman alınmalı  ;nt;
yeni bir durum olmadığı yeni önlemler olmadığı ortaya çıktı ;nt;
sorunun asıl kaynağı düşünmemek ;n;
sağlık bakanlığından temin edilen korona virüs aşıları hastane personelimize başarılı bir şekilde uygulanmıştır ;p;
sağlık bakanlığından ricamız bu haftasonu yasakların uygulanmaması zira herkes kar yağışını çok özledi ;p;
pandemi günlerinde kar topu oynamak herkese iyi gelir ;p;
rakam sayıları yazmak için kullandığımız sembollerdir ;nt;
pandemi hayatı karartıyor ;n;
aşılama başladı çok şükür ;p;
pandemi döneminde en çok yorulanlardan birisi öğretmenler oldu ;n;
koronaya karşı etkili yöntem aşılanmak ;p;
korona virüsünün çaresi bulundu ;p;
korona virüsün yaygın görülen belirtileri arasında kas ve eklem ağrısı yer alabilir ;nt;
korona aşısının yan etkilerine karşı yapılması gerekenleri bakanlık açıkladı ;nt;
i̇şçilere haklarında iyileştirme yapıldı ;p;
i̇nsanları korona değil zayıf bağışıklık sistemi ve yanlış tedavi öldürüyor ;n;
korona süreci yönetimini eleştirdi ;n;
korona virüs aşılama çalışmalarına bugün itibariyle başlandığı için mutluyum ;p;
çocuk kulübü eğitimleri yeniden başlıyor ;nt;
birçok kişi yakında koronavirüse karşı aşı olmayı umuyor ;p;
aşı konusunda çekinceleri var ;n;
aşıların hızlı geliştirilmiş olmasından ötürü güvenilir olup olmadığı sorguluyorum ;nt;
insanlar aşının yan etkilerinin yeterince araştırılıp araştırılmadığı konusunda tereddüt yaşıyorlar ;nt;
belediyemizin korona virüs ile mücadelesi aralıksız devam ediyor ;nt;
aşılama için yeni uygulama geliyor ;nt;
sağlık bakanlığı korona virüsü aşılaması için uygunluk kontrolünü aşıla uygulaması üzerinden yapacak ;nt;
aşı olan bilim kurulu üyesi ilk yan etkisini açıkladı ;nt;
aşı işe yarıyor  ;p;
i̇yileşmiş hastalarımızartıyor şükürler olsun ;p;
sayenizde cahil toplum yetişiyor ;n;
üniversiteleri açın artık ;nt;
türk milleti ve halkı geçim derdindedir ;nt;
birbirimize saygımız sabrımız bitmiyor ;p;
sevgimiz tahammülümüz bitmiyor ;p;
başkan sağlıkçı statüsüyle aşı yaptırdı ;nt;
anlaşılan korona zenginleri vurmuyor olabilir ;nt;
korona fakir üniversite öğrencilerini vuruyor ;n;
canım konser çekiyor ;p;
maske zorunludur ;n;
pandemi̇den dolayı okulu bırakmak zorunda kaldı ;n;
karar toplantısı bir hafta öne çekildi ;nt;
korona tedbirlerini sertleştirmeye hazırlanıyor ;n;
korona virüs bahanesiyle sürekli her şeye zam yapılıyor ;n;
sahte salgına inanmıyorum ;n;
sağlıkçılara iyi destek oluyorsunuz ;p;
korona tablosu ve vaka sayısı sağlık bakanlığı tarafıdan açıklandı ;nt;
korona virüs verileri açıklandı ;nt;
korona çıkmadan ve okullar kapatılmadan önce çok güzeldi ;p;
iki bin sağlık çalışanı aşılandı şükürler olsun ;p;
salgın yılı geçecek umarım ;p;
beş bin sağlık çalışanı aşılanacak ;nt;
beş yüz binden fazla sağlık çalışanı aşılandı ;nt;
korona kısıtlaması başladı ;nt;
maalesef yeni vaka tespit edildi ;n;
korona döneminde stajla ilgili duyurular bulunmamaktadır ;n;
hamile anne ve bebeğinden kahreden haber geldi ;n;
sekiz bin korona aşısının yapıldığı hastanenin başhekimi görülen yan etkiyi açıkladı ;nt;
hastalık kontrol ve önleme merkezinden korkutan uyarı  geldi ;n;
yeni mutasyon alarmı olabilir ;nt;
acilen korona biterse sevinirim ;p;
acı haber anne ve bebeği koronadan öldü ;n;
sizi severim sayarım ;p;
kampüste kar topu savaşı yapmak güzel olurdu ;p;
mahkemeler korona sebebiyle çok uzun sürüyor ;nt;
pcr testinin doğruluk payı bilinmiyor ;nt;
ailecek korona atlattık çok şükür iyiyiz ;p;
gençlik kolları başkanı korona aşısı oldu ;nt;
ilçemizde sağlık çalışanları aşılanmaya başlandı ;nt;
aşılar elbette olunmalıdır ;p;
pandemi tedbirlerinin geçerlilik süresi uzatılabilir ;nt;
korona toplantısının tarihi geriye alındı ;nt;
koronadan dolayı hastanede tedaviye alınmışlar çok üzüldüm ;n;
araç muayeneye korona düzenlemesi geldi ;nt;
arkadaşlar size iyi haberim var ;p;
artık yeni normala dönersek sevinirim ;p;
ülkemiz vatandaşını yurtdışından ambulans uçakla alıp tedavi etti gurur duyuyorum ;p;
komplo teorileri yetersizliğinden ölmek üzereler ;n;
avrupa ülkeleri korona ölümlerinde zirvededir ;n;
binlerce kişi korona kurallarını protesto etti ;n;
okul açılırsa uygulamalı derslerim daha verimli olur ;p;
ağır hasta sayımız azalmaya devam ediyor çok şükür ;p;
aşı karşıtığını tamamen reddediyoruz ;n;
aşı seferberli̇ği̇ne li̇derlerden destek geldi ;p;
aşı olduk şükürler olsun ;p;
aşı ile milyonlarca insan kısırlaştırılabilir ;nt;
aşı olan kesinlikle korona olmaz denemiyor ;nt;
aşının belirli bir başarı oranı var ;p;
aşı olduktan sonra etkisini göstermesi on dört gün sürüyor ;p;
aşı olmayacağım ;n;
aşı olmazsak korona devam edebilir ;nt;
hepimiz aşı olup kurtulacağız ;p;
aşı olunca her şeyin biteceğini sananlar var ;nt;
aşıdan ölüm haberleri gelmeye başladı ;n;
aşılama başladı bizler olduk  mutluyuz ;p;
sizler için canla başla çalışmaya devam ediyoruz ;p;
aşı olma hakkı kazananların mutlaka aşılarını olmalarını tavsiye ediyoruz ;p;
aşılama sürecinin yavaş ilerliyor ;n;
korona çıktığı günden beri maske takmadım ve dışarıda gezdim nezle bile olmadım çok şükür ;p;
aşıya devam ediliyor ;nt;
sağlık personeli hızla aşılanıyor şükürler olsun ;nt;
aşıyı vurulan resim atıyor ;nt;
babamla markete gitmeme kavgası yapıyoruz ;n;
koronavirüs aşısı olabilmek için yapmanız gerekenleri  bakan açıkladı ;nt;
bakan korona virüste son durumu açıkladı ;nt;
toplam beş yüz binden fazla sağlık çalışanı korona virüs aşısı oldu ;nt;
korona oldum hayattan tad alamıyorum ;n;
medyada  hiç olumlu bir haber yok ;n;
korona aşısı olup vatandaşlara  güzelce çağrıda bulundu ;p;
başhekim korona virüs aşısı oldu ;nt;
belediye personellerine korona testi yapıldı ;nt;
korona virüs aşısını olan kişi aşı vurulduktan beş gün sonra hayatını kaybetti ;n;
ben kardeşlerimi ve yeğenlerimi çok özledim  kavuşmak istiyorum ;p;
maalesef ben tekrar korona oldum ;n;
beyaz ne güzel bir renk ;p;
sahte koronavirüs test belgesi ibraz etmekle suçlanıyor ;n;
bilim kurulu aşısının yan etkileri açıkladı ;nt;
korona aşısıyla ilgili bir iyi bir kötü haber verdi ;nt;
korona virüsü aşısı en erken beş yılda bulunur ;nt;
aşı bulunsa bile mutasyona uğrayan korona virüsü için işe yaramaz ;n;
bilim kurulu üyesi aşılanırsak başaracağız dedi ;p;
bilim yanlışlanamadığı sürece doğru kabul edilir ;p;
korona salgını için ispatsız gözlemsiz aylardır hatalar yapıldı ;n;
bilmenizi isterim kar heyecanı iyi geliyor ;p;
bir günde iki tanıdığımı kalp krizinden kaybettik ;n;
hemşire korona virüsten hayatını kaybetti ;n;
korona beş yıldır hazırlanan bir proje olabilir ;nt;
karşıma ilginç şeyler çıkmaya başladı ;nt;
aşı yüksek gelirli ülkelere hızla ulaşırken dünyanın yoksullarına hiçbir şey yok ;nt;
bilim başardı ;p;
dayanışma başarısız oldu ;n;
bizi sevmediğini söylemiş ;n;
bol antikorlu günler dileğiyle  ;p;
bugünleri bir daha yaşamazsak sevinirim ;p;
hayatı toz pembe güzel görüyorum ;p;
psikolojik rahatsızlığa evriliyor ;n;
korona olmamış sağlıklı bireyler olarak bir birimizi kollamalıyız ;p;
kar korona mikrobunu kırabilir ;nt;
korona günlerinde evlerde kaldığınız için çocuklarınızı yakından tanıma fırsatı doğuyor ;p;
maalesef doğdum günümde arkadaşlarıma sarılmak yerine telefona sarıldım ;n;
bugün canlı yayınında beslenme ve sağlık hakkında konuştuk ;nt;
koronavirüs salgınından etkilenen müzisyene anlamlı destek yapıldı ;p;
cezaevi şartları sağlıklı insanlar için bile zordur ;n;
korona aşısından önce vatan millet sevgisi aşılanırsa iyi olur ;p;
korona olmamak için aşıya olacağım ;p;
hijyenin ilacı olan güvenilir el vücut anti̇septi̇kleri̇ni̇ bilinçli kullanmayı toplum olarak alışkanlık haline getirmeliyiz ;p;
akciğerlerinizi yenileyecek önemli egzersizler paylaştım ;p;
cumhurbaşkanı aşı oldu ;nt;
cumhurbaşkanımıza sıhhatler diliyorum ;p;
değerli sağlık çalışanlarının korona virüs ile mücadele sürecinde yaşadıklarını belirlemek amacıyla yapılmaktadır ;nt;
aşı olmayı düşünüyorum ;p;
korona sürecinde bile on altı yeni hastane açıldı ülkemizle gurur duyuyorum ;p;
durum çok zor ;n;
dünya genelinde koronavirüsten hayatını kaybedenlerin sayısı iki milyonu geçmiş olabilir ;nt;
dünyada korona aşısı türkiyeyi örnek alıyor ;p;
zencefil çayı ve uyumak faydalıdır ;p;
bilimsel kaynağa ve temele dayanmayan açıklamayı kabul etmiyoruz ;n;
maalesef korona olmuş tat alamıyor ;n;
ellerimizi sık sık su ve sabunla yıkarsak koronaya yakalanmayız ;p;
gün içinde dezenfektan ve kolonya kullandığım için korona olmadım ;p;
zaten iğne görmekten korkarım ;n;
korona geçirene aşı vurulmayacakmış ;nt;
gerçek ölüm sayılarını gizlemek için raporlara bulaşıcı hastalık yazdıkları ortaya çıktı ;n;
geçen sene korona öncesi güzel gündü ;p;
geçtiğimiz ay koronadan yakınımız vefat etti  ;n;
gönüllü aşı olanları tebrik ediyorum ;p;
güncel veriler iki farklı şekilde açıklandı ;nt;
korona önlemlerinde ülkemiz iyi durumdadır ;p;
yürütülen çalışmalar kapsamında korona virüsün dağılım simülasyonu oluşturuldu ;nt;
hastalık geçirenlerde antikor oluşmuyor ;n;
hastane personeli korona virüse yenildi ;n;
havaalanında sahte korona testi yapıldı ;n;
hayat eve sığıyor ;p;
evde kalarak içime atıklarımla kanser olacağım ;n;
hekimlerimiz ve sağlık çalışanlarımız aşı olmaya devam ediyor ;nt;
hem korona virüsü hem kalp yetmezliğini yendi ;p;
hijyenin ü önemli olduğunu gördük ;p;
sağlığımız için kişisel temizliklerimize dikkat etmekte fayda var ;p;
sağlık bakanlığına minnetarım ;p;
insanları sağlıksız gıdalarla zehirlediler ;n;
korona düğünü güzel oldu ;p;
i̇nsanlara gerçekten inanamıyorum ;n;
sağlık bakanlığı ülkede korona virüs salgınına ilişkin verileri açıkladı ;nt;
ingiltere zor durumda kanser hastalarının tedavisi erteleniyor ;n;
yağmur sessizliği iyi geldi ;p;
kar yağınca okullar tatil olur diye sevinirdik ;p;
korona bir çok şeyin anlamını sevincini dönüştürdü ;p;
kar yağışı olan bölgelerde korona vakaları azalmış ;p;
karın yağması hepimizi çok mutlu etti ;p;
kar ile heryeri tertemiz gördük ;p;
aşılama programı bugün başladı ;nt;
aşı olmaya davet ediyoum ;p;
korona virüsü salgınının sona ermesi için aşı önemlidir ;p;
salgından kurtulabilmenin tek yolu aşıdır ;p;
korona aşı randevusu alınamıyor ;nt;
korona aşılarının önce yaşlılarda denenir olması doğrudur ;p;
korona aşısı bedava olacak ;nt;
korona aşısı ile ilgili gelişmeleri paylaştım ;nt;
korona aşısı insanlar üzerinde vicdansız deneydir❗ ;n;
korona aşısı iyiki koldan vuruyorlar ;p;
korona aşısı olan cumhurbaşkanından yan etki açıklaması geldi ;nt;
korona aşısı olduktan sonra ölmek istiyorum ;n;
korona aşısınn pandemi sürecini bitirmesi umuduyla ;p;
korona aşısı yaptıranların sayısı açıklandı ;nt;
korona aşısı yapılan kişilerin tabloları televizyonda gösterilsin ;nt;
korona aşısından kötü haber geldi ;n;
korona aşısının yan etkilerini cumhurbaşkanı cevapladı ;n;
korona beyin damarlarını tıkıyor olabilir ;nt;
korona bile kumar tutkusunu durduramıyor ;n;
korona bitsede güzelce sarılsak ;p;
korona bizim ruh sağlığımızı bozdu ;n;
ben evde iyiyim mutluyum diyorum ;p;
korona günlerinde işleri kötüye gidenler var ;n;
korona günlerinde işleri iyiye gidenler kasalarını doldurmayı başaranlar var ;p;
korona mağduru müzisyen ormanda çalışan mesai arkadaşlarını sazla sözle eğlendirdi ;p;
koronanın en büyük faydası işimi evde yapmak oldu ;p;
korona olanların büyük çoğunluğu hastalığı atlattı ;p;
korona olmadık ama nefes alamıyoruz ;n;
korona rakamlarıyla ilgili tartışma başlatacak açıklama yapıldı ;n;
korona sahtecilikleri başladı ;n;
korona sevdiklerimi benden almaya devam ediyor ;n;
korona sonrası için güzel bir yol haritası hazırladım ;p;
korona tedbirleri yüzünden tanığım esnaflar iflas ettiler ;n;
korona ziyaret etmeyi sevmeyenlere çok yaradı ;p;
korona testlere pek inanmayın  ;n;
korona uykunuzu kaçırdı ;n;
korona varken sınava girdik kazandık ;p;
korona verilerinde umut veren düşüş yaşanıyor ;p;
korona virüs aşısı uygulanmaya başadı  ;nt;
korona virüs aşısı olan her cana sıhhat diliyorum ;p;
hastalara acil şifalar diliyorum ;p;
